id_events_group,description,name,type,organiser_login_email
1,ΣΠΑΛΙΑΡΑΣ Ναρκωτικά έτσι μάθαμε από μικρά παιδιά,Χαρούμενα παιδιά,Party,edutnall3@github.io
2,mi nulla ac enim in tempor turpis nec euismod scelerisque quam turpis adipiscing lorem vitae,Re-engineered secondary array,Party,edutnall3@github.io
3,metus aenean fermentum donec ut mauris eget massa tempor convallis nulla neque libero convallis eget eleifend luctus,Integrated actuating conglomeration,Sport,edutnall3@github.io
4,in faucibus orci luctus et ultrices posuere cubilia curae duis faucibus accumsan odio curabitur convallis duis consequat dui nec,Adaptive explicit matrices,Sport,edutnall3@github.io
5,nibh quisque id justo sit amet sapien dignissim vestibulum vestibulum ante ipsum primis in faucibus orci luctus et ultrices,Grass-roots background superstructure,Science,edutnall3@github.io
6,est congue elementum in hac habitasse platea dictumst morbi vestibulum velit id pretium iaculis diam,Open-source neutral alliance,Sport,edutnall3@github.io
7,congue eget semper rutrum nulla nunc purus phasellus in felis donec semper sapien a libero,Balanced solution-oriented intranet,Football,edutnall3@github.io
8,sapien cum sociis natoque penatibus et magnis dis parturient montes nascetur ridiculus mus etiam vel augue vestibulum rutrum rutrum,Face to face coherent protocol,Football,edutnall3@github.io
9,interdum mauris non ligula pellentesque ultrices phasellus id sapien in sapien iaculis congue vivamus metus,Cross-platform 24/7 encryption,Science,edutnall3@github.io
10,amet eleifend pede libero quis orci nullam molestie nibh in lectus pellentesque at nulla suspendisse potenti cras,Enhanced global secured line,Sport,edutnall3@github.io
11,duis bibendum felis sed interdum venenatis turpis enim blandit mi in porttitor pede justo eu massa donec,De-engineered bottom-line archive,Party,edutnall3@github.io
12,massa volutpat convallis morbi odio odio elementum eu interdum eu tincidunt in leo maecenas,Visionary uniform archive,Sport,edutnall3@github.io
13,ut tellus nulla ut erat id mauris vulputate elementum nullam varius nulla facilisi,Inverse transitional complexity,Music,edutnall3@github.io
14,erat nulla tempus vivamus in felis eu sapien cursus vestibulum proin eu mi nulla ac enim in,Multi-tiered multi-state approach,Music,edutnall3@github.io
15,posuere cubilia curae donec pharetra magna vestibulum aliquet ultrices erat tortor sollicitudin mi sit amet lobortis,Advanced mobile groupware,Science,edutnall3@github.io
16,ac est lacinia nisi venenatis tristique fusce congue diam id ornare imperdiet sapien urna pretium nisl ut volutpat,Sharable holistic concept,Sport,edutnall3@github.io
17,rutrum rutrum neque aenean auctor gravida sem praesent id massa id nisl venenatis lacinia aenean sit amet justo morbi ut,Enhanced tangible complexity,Science,edutnall3@github.io
18,ac est lacinia nisi venenatis tristique fusce congue diam id ornare imperdiet sapien urna pretium,Re-contextualized composite structure,Party,edutnall3@github.io
19,vivamus metus arcu adipiscing molestie hendrerit at vulputate vitae nisl aenean lectus pellentesque eget nunc donec quis orci eget,Switchable background analyzer,Football,edutnall3@github.io
20,sit amet eleifend pede libero quis orci nullam molestie nibh,Decentralized transitional matrices,Football,edutnall3@github.io
21,odio justo sollicitudin ut suscipit a feugiat et eros vestibulum ac est lacinia,Vision-oriented system-worthy budgetary management,Sport,edutnall3@github.io
22,at ipsum ac tellus semper interdum mauris ullamcorper purus sit amet nulla quisque arcu,Triple-buffered system-worthy strategy,Football,edutnall3@github.io
23,nisi venenatis tristique fusce congue diam id ornare imperdiet sapien urna pretium nisl ut volutpat sapien arcu,Ergonomic tertiary approach,Football,edutnall3@github.io
24,erat nulla tempus vivamus in felis eu sapien cursus vestibulum proin eu mi nulla ac enim in,Organic intermediate protocol,Science,edutnall3@github.io
25,nulla dapibus dolor vel est donec odio justo sollicitudin ut suscipit a feugiat et,Multi-tiered dynamic pricing structure,Music,edutnall3@github.io
26,convallis eget eleifend luctus ultricies eu nibh quisque id justo sit amet sapien dignissim,Synchronised fault-tolerant concept,Party,edutnall3@github.io
27,nullam orci pede venenatis non sodales sed tincidunt eu felis fusce posuere felis sed lacus morbi sem,Multi-channelled disintermediate paradigm,Sport,edutnall3@github.io
28,quam sapien varius ut blandit non interdum in ante vestibulum ante ipsum primis in faucibus orci luctus,Assimilated hybrid open architecture,Science,edutnall3@github.io
29,ornare consequat lectus in est risus auctor sed tristique in tempus sit amet sem fusce consequat nulla nisl,Persistent static initiative,Music,edutnall3@github.io
30,vel nulla eget eros elementum pellentesque quisque porta volutpat erat quisque erat,Innovative transitional info-mediaries,Music,edutnall3@github.io
31,non lectus aliquam sit amet diam in magna bibendum imperdiet nullam orci,Persevering 24 hour model,Party,edutnall3@github.io
32,praesent lectus vestibulum quam sapien varius ut blandit non interdum in ante vestibulum ante ipsum primis in faucibus orci luctus,Customizable stable Graphic Interface,Music,edutnall3@github.io
33,quis odio consequat varius integer ac leo pellentesque ultrices mattis odio donec vitae nisi nam,Streamlined bifurcated utilisation,Football,edutnall3@github.io
34,odio donec vitae nisi nam ultrices libero non mattis pulvinar nulla pede ullamcorper augue a suscipit,Intuitive composite emulation,Party,edutnall3@github.io
35,cursus urna ut tellus nulla ut erat id mauris vulputate elementum nullam varius nulla facilisi cras non,Persistent transitional flexibility,Football,edutnall3@github.io
36,sit amet eleifend pede libero quis orci nullam molestie nibh in lectus pellentesque at nulla suspendisse potenti cras in,Polarised secondary website,Music,edutnall3@github.io
37,sed magna at nunc commodo placerat praesent blandit nam nulla integer pede justo lacinia eget tincidunt eget tempus vel,Future-proofed full-range throughput,Football,edutnall3@github.io
38,rhoncus sed vestibulum sit amet cursus id turpis integer aliquet massa id lobortis,Face to face non-volatile matrix,Football,edutnall3@github.io
39,tristique fusce congue diam id ornare imperdiet sapien urna pretium nisl ut volutpat sapien arcu sed,Synergistic demand-driven frame,Science,edutnall3@github.io
40,suscipit nulla elit ac nulla sed vel enim sit amet nunc viverra dapibus nulla suscipit ligula,Assimilated context-sensitive matrices,Sport,edutnall3@github.io
41,aliquam lacus morbi quis tortor id nulla ultrices aliquet maecenas leo,Up-sized 6th generation conglomeration,Football,edutnall3@github.io
42,magna vestibulum aliquet ultrices erat tortor sollicitudin mi sit amet,Function-based actuating moratorium,Sport,edutnall3@github.io
43,fusce lacus purus aliquet at feugiat non pretium quis lectus suspendisse potenti in eleifend quam,Team-oriented asynchronous orchestration,Party,edutnall3@github.io
44,iaculis diam erat fermentum justo nec condimentum neque sapien placerat ante nulla justo aliquam,Mandatory global analyzer,Sport,edutnall3@github.io
45,nibh quisque id justo sit amet sapien dignissim vestibulum vestibulum ante ipsum primis in faucibus orci luctus et ultrices,Organic content-based pricing structure,Party,edutnall3@github.io
46,at ipsum ac tellus semper interdum mauris ullamcorper purus sit amet nulla quisque arcu libero,Sharable eco-centric middleware,Football,edutnall3@github.io
47,commodo placerat praesent blandit nam nulla integer pede justo lacinia,Fully-configurable maximized database,Science,edutnall3@github.io
48,libero rutrum ac lobortis vel dapibus at diam nam tristique tortor eu,Innovative non-volatile strategy,Party,edutnall3@github.io
49,condimentum neque sapien placerat ante nulla justo aliquam quis turpis eget elit sodales scelerisque mauris sit amet,Integrated user-facing analyzer,Football,edutnall3@github.io
50,viverra diam vitae quam suspendisse potenti nullam porttitor lacus at turpis,Reverse-engineered bottom-line challenge,Sport,edutnall3@github.io
